{
  "title": "Translation",
  "description": "Translation from Russian to English using the Hugging Face Interface API",
  "version": "0.0.1",
  "edges": [
    {
      "from": "fetch-5",
      "to": "main",
      "out": "*",
      "in": ""
    },
    {
      "from": "fn-3",
      "to": "fetch-5",
      "out": "auth",
      "in": "headers"
    },
    {
      "from": "fn-4",
      "to": "fetch-5",
      "out": "payload",
      "in": "body"
    },
    {
      "from": "main",
      "to": "output-2",
      "out": "output",
      "in": "output"
    },
    {
      "from": "query",
      "to": "fn-3",
      "out": "apiKey",
      "in": "key"
    },
    {
      "from": "query",
      "to": "fn-4",
      "out": "input",
      "in": "inputs"
    },
    {
      "from": "query",
      "to": "fn-4",
      "out": "use_cache",
      "in": "use_cache"
    },
    {
      "from": "query",
      "to": "fn-4",
      "out": "wait_for_model",
      "in": "wait_for_model"
    }
  ],
  "nodes": [
    {
      "id": "query",
      "type": "input",
      "configuration": {
        "schema": {
          "title": "Hugging Face Schema For RUSSIAN TO ENGLISH TRANSLATION",
          "properties": {
            "apiKey": {
              "type": "string",
              "title": "apiKey",
              "default": "myKey",
              "description": "The hugging face api key"
            },
            "inputs": {
              "type": "string",
              "title": "data",
              "default": "Меня зовут Вольфганг и я живу в Берлине",
              "description": "The data to send to the hugging face api Translation API (Russian To English)"
            },
            "use_cache": {
              "type": "boolean",
              "title": "use_cache",
              "default": "true",
              "description": "Boolean. There is a cache layer on the inference API to speedup requests we have already seen. Most models can use those results as is as models are deterministic (meaning the results will be the same anyway). However if you use a non deterministic model, you can set this parameter to prevent the caching mechanism from being used resulting in a real new query"
            },
            "wait_for_model": {
              "type": "boolean",
              "title": "wait_for_model",
              "default": "false",
              "description": " Boolean. If the model is not ready, wait for it instead of receiving 503. It limits the number of requests required to get your inference done. It is advised to only set this flag to true after receiving a 503 error as it will limit hanging in your application to known places"
            }
          }
        },
        "type": "string"
      }
    },
    {
      "id": "main",
      "type": "output",
      "configuration": {}
    },
    {
      "id": "output-2",
      "type": "output",
      "configuration": {
        "schema": {
          "type": "object",
          "properties": {
            "output": {
              "type": "string",
              "title": "output"
            }
          }
        }
      }
    },
    {
      "id": "fetch-5",
      "type": "fetch",
      "configuration": {
        "method": "POST",
        "url": "https://api-inference.huggingface.co/models/Helsinki-NLP/opus-mt-ru-en"
      }
    },
    {
      "id": "fn-3",
      "type": "runJavascript",
      "configuration": {
        "code": "const fn_3 = inputs=>{const key=inputs.key;const auth={Authorization:`Bearer ${key}`};return{auth}};",
        "name": "fn_3",
        "raw": true
      }
    },
    {
      "id": "fn-4",
      "type": "runJavascript",
      "configuration": {
        "code": "const fn_4 = input=>{const{inputs,use_cache,wait_for_model}=input;const request={inputs,parameters:{options:{use_cache,wait_for_model}}};const payload=JSON.stringify(request);return{payload}};",
        "name": "fn_4",
        "raw": true
      }
    }
  ]
}