{
  "title": "Text Generator",
  "description": "This is a text generator. It can generate text using various LLMs. Currently, it supports the following models: Google Gemini Pro and OpenAI GPT-3.5 Turbo.",
  "version": "0.0.2",
  "edges": [
    {
      "from": "input-0",
      "to": "invoke",
      "out": "text",
      "in": "text"
    },
    {
      "from": "input-0",
      "to": "invoke",
      "out": "useStreaming",
      "in": "useStreaming"
    },
    {
      "from": "input-0",
      "to": "runJavascript-0",
      "out": "MODEL",
      "in": "MODEL"
    },
    {
      "from": "invoke",
      "to": "output-0",
      "out": "text",
      "in": "textOutput"
    },
    {
      "from": "runJavascript-0",
      "to": "invoke",
      "out": "path",
      "in": "$board"
    }
  ],
  "nodes": [
    {
      "id": "input-0",
      "type": "input",
      "configuration": {
        "schema": {
          "type": "object",
          "properties": {
            "MODEL": {
              "type": "string",
              "title": "Model",
              "description": "The model to use for generation",
              "examples": [
                "Gemini Pro"
              ],
              "enum": [
                "Gemini Pro",
                "GPT 3.5 Turbo"
              ]
            },
            "text": {
              "type": "string",
              "title": "Text",
              "description": "The text to generate"
            },
            "useStreaming": {
              "type": "boolean",
              "title": "Stream",
              "description": "Whether to stream the output",
              "default": "false"
            }
          },
          "required": [
            "MODEL",
            "text"
          ]
        }
      }
    },
    {
      "id": "output-0",
      "type": "output",
      "configuration": {
        "schema": {
          "type": "object",
          "properties": {
            "textOutput": {
              "type": [
                "array",
                "boolean",
                "null",
                "number",
                "object",
                "string"
              ],
              "title": "Text",
              "description": "The generated text"
            }
          },
          "required": [
            "textOutput"
          ]
        }
      }
    },
    {
      "id": "invoke",
      "type": "invoke",
      "configuration": {}
    },
    {
      "id": "runJavascript-0",
      "type": "runJavascript",
      "configuration": {
        "code": "const run = ({MODEL:MODEL2})=>{const models={\"Gemini Pro\":\"gemini-generator.json\",\"GPT 3.5 Turbo\":\"openai-gpt-35-turbo.json\"};const path=models[MODEL2];if(!path)throw new Error(`Unsupported model: ${MODEL2}`);return{path}};",
        "name": "run",
        "raw": true
      }
    }
  ]
}